{"schemaVersion":"cobol-annotated-ir.v1","baseIrVersion":"cobol-ir.v1","baseIrHash":"9e4f202eb7d8469d78d316d7f588a3d91b07b6422f47ab853a85af587f8321ce","annotations":[{"annotationId":"d851be1c6a6aa066afa07dc99cccdc088b32e8ac30fc43d7fcd3bea81653c8bb","nodeId":"e6b2813579d8d3acb3a0e152753d44bbeeea3ae1252ca7cfafee5088b02530a0","nodeKind":"DATA_ITEM","annotationFamily":"DATA_INTENT","payload":{"construction":"REDEFINES","interpretation":"Numeric view overlays the raw record","assumptions":["raw and numeric views share storage"]},"confidence":0.95,"provenance":{"provider":"offline","model":"fixture","promptId":"cobol.data.intent.v1","promptVersion":"v1","outputSchemaVersion":"data-intent.v1","inputHash":"1111111111111111111111111111111111111111111111111111111111111111","outputHash":"bea2dc4ccf9c4816e831f9eab32b7693440dad359e41be02d23d0a76a2978e7f","toolRunRef":"tool-20260830t12345678901234z","cacheDisposition":"HIT"},"review":{"reviewState":"ACCEPTED","reviewedBy":"fixture-reviewer","reviewedAt":"2026-08-31T00:00:00Z"}}]}
