{"schemaVersion":"cobol-annotated-ir.v1","baseIrVersion":"cobol-ir.v1","baseIrHash":"74635633fe3c566eee83be753693cf51aa536257c51913d7dc55fb077b760f02","annotations":[{"annotationId":"0e71eb253019894a6b02369cca5656ee628fcf631a0fbd3dbadfb8996133d813","nodeId":"6b6860978286ccf73a068582c86ca3ad7f3838b65e6f153ba96850d8c7045baa","nodeKind":"DATA_ITEM","annotationFamily":"DOMAIN_NAMING","payload":{"suggestedName":"roundedTotal","boundedContext":"Accounting","rationale":"domain-aligned target"},"confidence":0.95,"provenance":{"provider":"offline","model":"fixture","promptId":"cobol.domain.naming.v1","promptVersion":"v1","outputSchemaVersion":"domain-naming.v1","inputHash":"1111111111111111111111111111111111111111111111111111111111111111","outputHash":"29dc7aeb7a38dbd28541f86816142fc809e9b6cb51f1b86034d64d30516494ab","toolRunRef":"tool-20260830t12345678901234z","cacheDisposition":"HIT"},"review":{"reviewState":"ACCEPTED","reviewedBy":"fixture-reviewer","reviewedAt":"2026-08-31T00:00:00Z"}}]}
